show_id,type,title,cast,country,date_added,release_year,rating,duration,listed_in
s1,Movie,Dick Johnson Is Dead,,United States,25-Sep-21,2020,PG-13,90 min,Documentaries
s8,Movie,Sankofa,"Kofi Ghanaba, Oyafunmike Ogunlano, Alexandra Duah, Nick Medley, Mutabaruka, Afemo Omilami, Reggie Carter, Mzuri","United States, Ghana, Burkina Faso, United Kingdom, Germany, Ethiopia",24-Sep-21,1993,TV-MA,125 min,"Dramas, Independent Movies, International Movies"
s9,TV Show,The Great British Baking Show,"Mel Giedroyc, Sue Perkins, Mary Berry, Paul Hollywood",United Kingdom,24-Sep-21,2021,TV-14,9 Seasons,"British TV Shows, Reality TV"
s10,Movie,The Starling,"Melissa McCarthy, Chris O'Dowd, Kevin Kline, Timothy Olyphant, Daveed Diggs, Skyler Gisondo, Laura Harrier, Rosalind Chao, Kimberly Quinn, Loretta Devine, Ravi Kapoor",United States,24-Sep-21,2021,PG-13,104 min,"Comedies, Dramas"
s16,TV Show,Dear White People,"Logan Browning, Brandon P. Bell, DeRon Horton, Antoinette Robertson, John Patrick Amedori, Ashley Blaine Featherson, Marque Richardson, Giancarlo Esposito",United States,22-Sep-21,2021,TV-MA,4 Seasons,"TV Comedies, TV Dramas"
s28,Movie,Grown Ups,"Adam Sandler, Kevin James, Chris Rock, David Spade, Rob Schneider, Salma Hayek, Maria Bello, Maya Rudolph, Colin Quinn, Tim Meadows, Joyce Van Patten",United States,20-Sep-21,2010,PG-13,103 min,Comedies
s29,Movie,Dark Skies,"Keri Russell, Josh Hamilton, J.K. Simmons, Dakota Goyo, Kadan Rockett, L.J. Benet, Rich Hutchman, Myndy Crist, Annie Thurman, Jake Brennan",United States,19-Sep-21,2013,PG-13,97 min,"Horror Movies, Sci-Fi & Fantasy"
s30,Movie,Paranoia,"Liam Hemsworth, Gary Oldman, Amber Heard, Harrison Ford, Lucas Till, Embeth Davidtz, Julian McMahon, Josh Holloway, Richard Dreyfuss, Angela Sarafyan","United States, India, France",19-Sep-21,2013,PG-13,106 min,Thrillers
s33,TV Show,Sex Education,"Asa Butterfield, Gillian Anderson, Ncuti Gatwa, Emma Mackey, Connor Swindells, Kedar Williams-Stirling, Alistair Petrie",United Kingdom,17-Sep-21,2020,TV-MA,3 Seasons,"British TV Shows, International TV Shows, TV Comedies"
s39,Movie,Birth of the Dragon,"Billy Magnussen, Ron Yuan, Qu Jingjing, Terry Chen, Vanness Wu, Jin Xing, Philip Ng, Xia Yu, Yu Xia","China, Canada, United States",16-Sep-21,2017,PG-13,96 min,"Action & Adventure, Dramas"
s41,TV Show,He-Man and the Masters of the Universe,"Yuri Lowenthal, Kimberly Brooks, Antony Del Rio, Trevor Devall, Ben Diskin, Grey Griffin, David Kaye, Tom Kenny, Judy Alice Lee, Roger Craig Smith, Fred Tatasciore",United States,16-Sep-21,2021,TV-Y7,1 Season,"Kids' TV, TV Sci-Fi & Fantasy"
s42,Movie,Jaws,"Roy Scheider, Robert Shaw, Richard Dreyfuss, Lorraine Gary, Murray Hamilton, Carl Gottlieb, Jeffrey Kramer, Susan Backlinie, Jonathan Filley, Ted Grossman",United States,16-Sep-21,1975,PG,124 min,"Action & Adventure, Classic Movies, Dramas"
s43,Movie,Jaws 2,"Roy Scheider, Lorraine Gary, Murray Hamilton, Joseph Mascolo, Jeffrey Kramer, Collin Wilcox Paxton, Ann Dusenberry, Mark Gruner, Barry Coe, Susan French",United States,16-Sep-21,1978,PG,116 min,"Dramas, Horror Movies, Thrillers"
s44,Movie,Jaws 3,"Dennis Quaid, Bess Armstrong, Simon MacCorkindale, Louis Gossett Jr., John Putch, Lea Thompson, P.H. Moriarty, Dan Blasko, Liz Morris, Lisa Maurer",United States,16-Sep-21,1983,PG,98 min,"Action & Adventure, Horror Movies, Thrillers"
s45,Movie,Jaws: The Revenge,"Lorraine Gary, Lance Guest, Mario Van Peebles, Karen Young, Michael Caine, Judith Barsi, Mitchell Anderson, Lynn Whitfield",United States,16-Sep-21,1987,PG-13,91 min,"Action & Adventure, Horror Movies, Thrillers"
s47,Movie,Safe House,"Denzel Washington, Ryan Reynolds, Vera Farmiga, Brendan Gleeson, Sam Shepard, Rubén Blades, Nora Arnezeder, Robert Patrick, Liam Cunningham, Joel Kinnaman","South Africa, United States, Japan",16-Sep-21,2012,R,115 min,Action & Adventure
s49,Movie,Training Day,"Denzel Washington, Ethan Hawke, Scott Glenn, Tom Berenger, Harris Yulin, Raymond J. Barry, Cliff Curtis, Dr. Dre, Snoop Dogg, Macy Gray, Eva Mendes",United States,16-Sep-21,2001,R,122 min,"Dramas, Thrillers"
s56,TV Show,Nailed It,"Nicole Byer, Jacques Torres",United States,15-Sep-21,2021,TV-PG,6 Seasons,Reality TV
s66,TV Show,Numberblocks,"Beth Chalmers, David Holt, Marcel McCalla, Teresa Gallagher",United Kingdom,15-Sep-21,2021,TV-Y,6 Seasons,Kids' TV
s68,TV Show,Saved by the Bell,"Mark-Paul Gosselaar, Tiffani Thiessen, Mario Lopez, Lark Voorhies, Elizabeth Berkley, Dustin Diamond, Dennis Haskins",United States,15-Sep-21,1994,TV-PG,9 Seasons,"Kids' TV, TV Comedies"
s73,TV Show,Jack Whitehall: Travels with My Father,"Jack Whitehall, Michael Whitehall",United Kingdom,14-Sep-21,2021,TV-MA,5 Seasons,"British TV Shows, Docuseries, International TV Shows"
s82,Movie,Kate,"Mary Elizabeth Winstead, Jun Kunimura, Woody Harrelson, Tadanobu Asano, Miyavi, Michiel Huisman, Miku Martineau",United States,10-Sep-21,2021,R,106 min,Action & Adventure
s83,TV Show,Lucifer,"Tom Ellis, Lauren German, Kevin Alejandro, D.B. Woodside, Lesley-Ann Brandt, Scarlett Estevez, Rachael Harris, Aimee Garcia, Tricia Helfer, Tom Welling, Jeremiah W. Birkett, Pej Vahdat, Michael Gladis",United States,10-Sep-21,2021,TV-14,6 Seasons,"Crime TV Shows, TV Comedies, TV Dramas"
s91,Movie,Paradise Hills,"Emma Roberts, Danielle Macdonald, Awkwafina, Eiza González, Milla Jovovich, Jeremy Irvine, Arnaud Valois, Daniel Horvath","Spain, United States",09-Sep-21,2019,TV-MA,95 min,"Sci-Fi & Fantasy, Thrillers"
s95,Movie,Show Dogs,"Will Arnett, Ludacris, Natasha Lyonne, Stanley Tucci, Jordin Sparks, Gabriel Iglesias, Shaquille O'Neal, Omar Chaparro, Alan Cumming, Andy Beckwith, Delia Sheppard, Kerry Shale","United Kingdom, United States",08-Sep-21,2018,PG,90 min,"Children & Family Movies, Comedies"
s96,TV Show,The Circle,Michelle Buteau,"United States, United Kingdom",08-Sep-21,2021,TV-MA,3 Seasons,Reality TV
s97,Movie,If I Leave Here Tomorrow: A Film About Lynyrd Skynyrd,"Ronnie Van Zandt, Gary Rossington, Allen Collins, Leon Wilkeson, Bob Burns, Billy Powell, Ed King, Artimus Pyle, Steve Gaines, Johnny Van Zant",United States,07-Sep-21,2018,TV-MA,97 min,"Documentaries, Music & Musicals"
s98,TV Show,Kid Cosmic,"Jack Fisher, Tom Kenny, Amanda C. Miller, Kim Yarbrough, Keith Ferguson, Grey Griffin, Lily Rose Silver",United States,07-Sep-21,2021,TV-Y7,2 Seasons,"Kids' TV, TV Comedies, TV Sci-Fi & Fantasy"
s99,TV Show,Octonauts: Above & Beyond,"Antonio Aakeel, Chipo Chung, Simon Foster, Teresa Gallagher, Simon Greenall, Kate Harbour, Paul Panting, Rob Rackstraw, William Vanderpuye, Helen Walsh, Keith Wickham, Andres Williams, Jo Wyatt",United Kingdom,07-Sep-21,2021,TV-Y,1 Season,"British TV Shows, Kids' TV"
s100,TV Show,On the Verge,"Julie Delpy, Elisabeth Shue, Sarah Jones, Alexia Landeau, Mathieu Demy, Troy Garity, Timm Sharp, Giovanni Ribisi","France, United States",07-Sep-21,2021,TV-MA,1 Season,"TV Comedies, TV Dramas"
s102,Movie,Untold: Breaking Point,,United States,07-Sep-21,2021,TV-MA,80 min,"Documentaries, Sports Movies"
s107,TV Show,Bunk'd,"Peyton List, Karan Brar, Skai Jackson, Miranda May, Kevin G. Quinn, Nathan Arenas, Nina Lu",United States,05-Sep-21,2021,TV-G,5 Seasons,"Kids' TV, TV Comedies"
s108,Movie,A Champion Heart,"Mandy Grace, David de Vos, Donna Rusch, Devan Key, Isabella Mancuso, Ariana Guido",United States,04-Sep-21,2018,G,90 min,"Children & Family Movies, Dramas"
s112,TV Show,Sharkdog,"Liam Mitchell, Dee Bradley Baker, Grey Griffin, Josh McDermitt, Kari Wahlgren, Judy Alice Lee, Ali Mawji","United States, Singapore",03-Sep-21,2021,TV-Y,1 Season,Kids' TV
s116,Movie,Bright Star,"Abbie Cornish, Ben Whishaw, Paul Schneider, Kerry Fox, Edie Martin, Thomas Brodie-Sangster, Claudie Blakley, Gerard Monaco, Antonia Campbell-Hughes, Samuel Roukin","United Kingdom, Australia, France",02-Sep-21,2009,PG,119 min,"Dramas, Romantic Movies"
s118,Movie,Final Account,,"United Kingdom, United States",02-Sep-21,2021,PG-13,94 min,Documentaries
s123,Movie,In the Cut,"Meg Ryan, Mark Ruffalo, Jennifer Jason Leigh, Nick Damici, Sharrieff Pugh, Kevin Bacon, Yaani King Mondschein, Heather Litteer","United Kingdom, Australia, France, United States",02-Sep-21,2003,R,118 min,Thrillers
s126,TV Show,Q-Force,"Sean Hayes, Wanda Sykes, Laurie Metcalf, David Harbour, Gary Cole, Patti Harrison, Matt Rogers",United States,02-Sep-21,2021,TV-MA,1 Season,"Crime TV Shows, TV Action & Adventure, TV Comedies"
s128,Movie,A Cinderella Story,"Hilary Duff, Chad Michael Murray, Jennifer Coolidge, Dan Byrd, Regina King, Julie Gonzalo, Lin Shaye, Madeline Zima, Andrea Avery, Mary Pat Gleason, Paul Rodriguez, Whip Hubley, Kevin Kilner, Erica Hubbard, Simon Helberg","United States, Canada",01-Sep-21,2004,PG,95 min,"Children & Family Movies, Comedies"
s130,Movie,An Unfinished Life,"Robert Redford, Jennifer Lopez, Morgan Freeman, Josh Lucas, Damian Lewis, Camryn Manheim, Becca Gardner, Lynda Boyd, Rob Hayter, P. Lynn Johnson","Germany, United States",01-Sep-21,2005,PG-13,108 min,Dramas
s132,Movie,Blade Runner: The Final Cut,"Harrison Ford, Rutger Hauer, Sean Young, Edward James Olmos, M. Emmet Walsh, Daryl Hannah, William Sanderson, Brion James, Joe Turkel, Joanna Cassidy, James Hong, Morgan Paull",United States,01-Sep-21,1982,R,117 min,"Action & Adventure, Classic Movies, Cult Movies"
s134,Movie,Chappie,"Sharlto Copley, Hugh Jackman, Sigourney Weaver, Dev Patel, Ninja, Yo-Landi Visser, Jose Pablo Cantillo, Brandon Auret, Johnny Selema, Maurice Carpede","South Africa, United States",01-Sep-21,2015,R,121 min,"Action & Adventure, Sci-Fi & Fantasy"
s135,Movie,Clear and Present Danger,"Harrison Ford, Willem Dafoe, Anne Archer, Joaquim de Almeida, Henry Czerny, Harris Yulin, Donald Moffat, Miguel Sandoval, Benjamin Bratt, Dean Jones, Thora Birch, James Earl Jones, Raymond Cruz","United States, Mexico",01-Sep-21,1994,PG-13,142 min,"Action & Adventure, Dramas"
s136,Movie,Cliffhanger,"Sylvester Stallone, John Lithgow, Michael Rooker, Janine Turner, Rex Linn, Caroline Goodall, Leon, Craig Fairbrass, Ralph Waite, Max Perlich, Paul Winfield","United States, Italy, France, Japan",01-Sep-21,1993,R,113 min,Action & Adventure
s137,Movie,Cold Mountain,"Jude Law, Nicole Kidman, Renée Zellweger, Eileen Atkins, Brendan Gleeson, Philip Seymour Hoffman, Natalie Portman, Giovanni Ribisi, Donald Sutherland, Ray Winstone","United States, Italy, Romania, United Kingdom",01-Sep-21,2003,R,154 min,"Dramas, Romantic Movies"
s138,Movie,Crocodile Dundee in Los Angeles,"Paul Hogan, Linda Kozlowski, Jere Burns, Jonathan Banks, Aida Turturro, Alec Wilson, Gerry Skilton, Steve Rackman, Serge Cockburn, Paul Rodriguez, Mark Adair-Rios, Tiriel Mora, Grant Piro, Mike Tyson","Australia, United States",01-Sep-21,2001,PG,95 min,"Action & Adventure, Comedies"
s139,Movie,Dear John,"Channing Tatum, Amanda Seyfried, Richard Jenkins, Henry Thomas, D.J. Cotrona, Cullen Moss, Gavin McCulley, Jose Lucena Jr., Keith Robinson, Scott Porter",United States,01-Sep-21,2010,PG-13,108 min,"Dramas, Romantic Movies"
s140,Movie,Do the Right Thing,"Danny Aiello, Ossie Davis, Ruby Dee, Richard Edson, Giancarlo Esposito, Spike Lee, Bill Nunn, John Turturro, Paul Benjamin, Frankie Faison, Samuel L. Jackson, Rosie Perez, Martin Lawrence, Miguel Sandoval",United States,01-Sep-21,1989,R,120 min,"Classic Movies, Comedies, Dramas"
s142,Movie,Extraction,"Bruce Willis, Kellan Lutz, Gina Carano, D.B. Sweeney, Joshua Mikel, Steve Coulter, Dan Bilzerian, Heather Johansen","United States, United Kingdom, Canada",01-Sep-21,2015,R,82 min,Action & Adventure
s143,Movie,Freedom Writers,"Hilary Swank, Patrick Dempsey, Scott Glenn, Imelda Staunton, April L. Hernandez, Mario, Kristin Herrera, Jaclyn Ngan, Sergio Montalvo, Jason Finn, Deance Wyatt, Vanetta Smith","Germany, United States",01-Sep-21,2007,PG-13,124 min,Dramas
s144,Movie,Green Lantern,"Ryan Reynolds, Blake Lively, Peter Sarsgaard, Mark Strong, Tim Robbins, Jay O. Sanders, Taika Waititi, Angela Bassett",United States,01-Sep-21,2011,PG-13,114 min,"Action & Adventure, Sci-Fi & Fantasy"
s145,Movie,House Party,"Christopher Reid, Christopher Martin, Robin Harris, Tisha Campbell, A.J. Johnson, Martin Lawrence, Paul Anthony, Bowlegged Lou, B-Fine, Edith Fields, Kelly Jo Minter, Clifton Powell, Verda Bridges",United States,01-Sep-21,1990,R,104 min,"Comedies, Cult Movies"
s146,Movie,House Party 2,"Christopher Reid, Christopher Martin, Martin Lawrence, Bowlegged Lou, Paul Anthony, B-Fine, Tisha Campbell, Kamron, Iman, Queen Latifah",United States,01-Sep-21,1991,R,94 min,"Comedies, Cult Movies, Music & Musicals"
s147,Movie,House Party 3,"Christopher Reid, Christopher Martin, Tisha Campbell, David Edwards, Angela Means, Ketty Lester, Bernie Mac, Michael Colyar, Chris Tucker, Khandi Alexander",United States,01-Sep-21,1994,R,94 min,"Comedies, Music & Musicals"
s150,Movie,I Got the Hook Up,"Master P, Anthony Johnson, Gretchen Palmer, Frantz Turner, Richard Keats, Joe Estevez, William Knight, Anthony Boswell, Tommy 'Tiny' Lister, Helen Martin, John Witherspoon, Mia X",United States,01-Sep-21,1998,R,93 min,"Action & Adventure, Comedies"
s151,Movie,In Too Deep,"Omar Epps, LL Cool J, Nia Long, Stanley Tucci, Pam Grier, Hill Harper, Jake Weber, David Patrick Kelly, Veronica Webb, Ron Canada, Robert LaSardo, Gano Grills, Ivonne Coll, Don Harvey, Mya, Nasir 'Nas' Jones, Jermaine Dupri",United States,01-Sep-21,1999,R,97 min,Thrillers
s153,Movie,Janoskians: Untold and Untrue,"Jai Brooks, Luke Brooks, James Yammouni, Daniel Sahyounie, Beau Brooks",United States,01-Sep-21,2016,TV-MA,88 min,Comedies
s156,Movie,Labyrinth,"David Bowie, Jennifer Connelly, Frank Oz, Kevin Clash, Anthony Asbury, Dave Goelz, Brian Henson, Ron Mueck, Karen Prell, Shari Weiser","United Kingdom, United States",01-Sep-21,1986,PG,101 min,"Action & Adventure, Children & Family Movies, Cult Movies"
s157,Movie,Letters to Juliet,"Amanda Seyfried, Christopher Egan, Gael García Bernal, Vanessa Redgrave, Franco Nero, Luisa Ranieri, Marina Massironi, Milena Vukotic, Marcia DeBonis, Luisa De Santis, Lidia Biondi, Giordano Formenti, Chris Egan",United States,01-Sep-21,2010,PG,105 min,"Comedies, Dramas, Romantic Movies"
s159,Movie,Love Don't Cost a Thing,"Nick Cannon, Christina Milian, Kenan Thompson, Kal Penn, Steve Harvey, Al Thompson, Ashley Monique Clark, Elimu Nelson, Nichole Robinson, Melissa Schuman",United States,01-Sep-21,2003,PG-13,101 min,"Comedies, Romantic Movies"
s161,TV Show,Major Dad,"Gerald McRaney, Shanna Reed, Nicole Dubuc, Chelsea Hertford, Marisa Ryan, Matt Mulhern, Beverly Archer, Jon Cypher",United States,01-Sep-21,1992,TV-PG,4 Seasons,TV Comedies
s162,Movie,Mars Attacks!,"Jack Nicholson, Glenn Close, Annette Bening, Pierce Brosnan, Danny DeVito, Martin Short, Sarah Jessica Parker, Michael J. Fox, Rod Steiger, Tom Jones, Lukas Haas, Natalie Portman",United States,01-Sep-21,1996,PG-13,106 min,"Comedies, Cult Movies, Sci-Fi & Fantasy"
s163,Movie,Marshall,"Chadwick Boseman, Josh Gad, Kate Hudson, Sterling K. Brown, Dan Stevens, James Cromwell, Keesha Sharp, Roger Guenveur Smith, Derrick Baskin, Barrett Doss","United States, China, Hong Kong",01-Sep-21,2017,PG-13,118 min,Dramas
s164,Movie,My Boss's Daughter,"Ashton Kutcher, Tara Reid, Jeffrey Tambor, Andy Richter, Michael Madsen, Jon Abrahams, David Koechner, Carmen Electra, Kenan Thompson, Terence Stamp, Molly Shannon",United States,01-Sep-21,2003,R,86 min,"Comedies, Romantic Movies"
s165,Movie,Mystery Men,"Ben Stiller, Hank Azaria, William H. Macy, Janeane Garofalo, Kel Mitchell, Paul Reubens, Wes Studi, Greg Kinnear, Geoffrey Rush, Lena Olin, Eddie Izzard, Artie Lange, Pras, Claire Forlani, Tom Waits",United States,01-Sep-21,1999,PG-13,121 min,"Action & Adventure, Comedies"
s167,Movie,Once Upon a Time in America,"Robert De Niro, James Woods, Elizabeth McGovern, Treat Williams, Tuesday Weld, Burt Young, Joe Pesci, Danny Aiello, William Forsythe, James Hayden","Italy, United States",01-Sep-21,1984,R,229 min,"Classic Movies, Dramas"
s168,Movie,Open Season 2,"Joel McHale, Mike Epps, Jane Krakowski, Billy Connolly, Crispin Glover, Steve Schirripa, Georgia Engel, Diedrich Bader, Cody Cameron, Fred Stoller, Olivia Hack","United States, Canada",01-Sep-21,2008,PG,76 min,"Children & Family Movies, Comedies"
s169,Movie,Osmosis Jones,"Chris Rock, Laurence Fishburne, David Hyde Pierce, Brandy Norwood, William Shatner, Ron Howard, Kid Rock, Ben Stein",United States,01-Sep-21,2001,PG,95 min,"Action & Adventure, Children & Family Movies, Comedies"
s170,Movie,Poseidon,"Josh Lucas, Kurt Russell, Jacinda Barrett, Richard Dreyfuss, Emmy Rossum, Mía Maestro, Mike Vogel, Kevin Dillon, Freddy Rodríguez",United States,01-Sep-21,2006,PG-13,98 min,"Action & Adventure, Dramas"
s171,Movie,Rhyme & Reason,"Too $hort, B-Real, Kurtis Blow, Da Brat, Grandmaster Caz, Sean ""P. Diddy"" Combs, Chuck D., Desiree Densiti, Dr. Dre, E-40, MC Eiht, Heavy D, Lauryn Hill, Ice-T, Wyclef Jean, Ras Kass, KRS-One, L.V., Mack 10, Craig Mack, Method Man, Keith Murray, Nasir 'Nas' Jones, The Notorious B.I.G., Master P, Q-Tip, Raekwon, Redman, Senen Reyes, Busta Rhymes, RZA, DJ Scratch, Erick Sermon, Tupac Shakur, Adario Strange, Suave",United States,01-Sep-21,1997,R,89 min,"Documentaries, Music & Musicals"
s172,Movie,Same Kind of Different as Me,"Greg Kinnear, Renée Zellweger, Djimon Hounsou, Jon Voight, Olivia Holt",United States,01-Sep-21,2017,PG-13,120 min,"Dramas, Faith & Spirituality"
s173,Movie,School of Rock,"Jack Black, Joan Cusack, Mike White, Sarah Silverman, Lee Wilkof, Kate McGregor-Stewart, Adam Pascal, Suzzanne Douglas, Miranda Cosgrove, Kevin Alexander Clark, Joey Gaydos Jr., Robert Tsai, Veronica Afflerbach, Jordan-Claire Green","United States, Germany",01-Sep-21,2003,PG-13,110 min,"Comedies, Music & Musicals"
s174,Movie,Snervous Tyler Oakley,Tyler Oakley,United States,01-Sep-21,2015,PG-13,83 min,"Documentaries, LGBTQ Movies"
s175,Movie,Tears of the Sun,"Bruce Willis, Monica Bellucci, Cole Hauser, Eamonn Walker, Johnny Messner, Nick Chinlund, Charles Ingram, Paul Francis, Chad Smith, Tom Skerritt, Malick Bowens, Awaovieyi Agie",United States,01-Sep-21,2003,R,121 min,"Action & Adventure, Dramas"
s176,Movie,The Blue Lagoon,"Brooke Shields, Christopher Atkins, Leo McKern, William Daniels, Elva Josephson, Glenn Kohan, Alan Hopgood, Gus Mercurio",United States,01-Sep-21,1980,R,105 min,"Dramas, Romantic Movies"
s177,Movie,The Golden Child,"Eddie Murphy, J.L. Reate, Charles Dance, Charlotte Lewis, Victor Wong, Randall Tex Cobb, James Hong, Shakti Chen, Tau Logo, Tiger Chung Lee",United States,01-Sep-21,1986,PG-13,94 min,"Action & Adventure, Comedies"
s178,Movie,The Guns of Navarone,"Gregory Peck, David Niven, Anthony Quinn, Stanley Baker, Anthony Quayle, James Darren, Irene Papas, Gia Scala, James Robertson Justice, Richard Harris","United Kingdom, United States",01-Sep-21,1961,TV-14,156 min,"Action & Adventure, Classic Movies"
s179,Movie,The Interview,"James Franco, Seth Rogen, Lizzy Caplan, Randall Park, Diana Bang, Timothy Simons, Reese Alexander, James Yi",United States,01-Sep-21,2014,R,112 min,"Action & Adventure, Comedies"
s180,Movie,The Nutty Professor,"Eddie Murphy, Jada Pinkett Smith, James Coburn, Larry Miller, Dave Chappelle, John Ales, Patricia Wilson, Jamal Mixon",United States,01-Sep-21,1996,PG-13,95 min,"Comedies, Romantic Movies"
s183,Movie,Welcome Home Roscoe Jenkins,"Martin Lawrence, James Earl Jones, Joy Bryant, Margaret Avery, Mike Epps, Mo'Nique, Cedric the Entertainer, Nicole Ari Parker, Michael Clarke Duncan, Louis C.K.",United States,01-Sep-21,2008,PG-13,114 min,Comedies
s184,Movie,In the Line of Fire,"Clint Eastwood, John Malkovich, Rene Russo, Dylan McDermott, Gary Cole, Fred Thompson, John Mahoney, Gregory Alan Williams, Jim Curley, Sally Hughes",United States,31-Aug-21,1993,R,129 min,"Action & Adventure, Classic Movies"
s185,TV Show,Sparking Joy,Marie Kondo,United States,31-Aug-21,2021,TV-PG,1 Season,Reality TV
s192,Movie,Wind River,"Jeremy Renner, Elizabeth Olsen, Jon Bernthal, Gil Birmingham, Kelsey Asbille, Tantoo Cardinal, Teo Briones, Matthew Del Negro, Hugh Dillon, Julia Jones, James Jordan, Eric Lange, Martin Sensmeier, Mason Davis, Graham Greene","United Kingdom, Canada, United States",28-Aug-21,2017,R,107 min,"Dramas, Independent Movies"
s221,TV Show,Family Reunion,"Loretta Devine, Tia Mowry-Hardrict, Anthony Alabi, Talia Jackson, Isaiah Russell-Bailey, Cameron J. Wright, Jordyn Raya James, Richard Roundtree",United States,26-Aug-21,2021,TV-PG,4 Seasons,"Kids' TV, TV Comedies"
s228,Movie,Really Love,"Kofi Siriboe, Yootha Wong-Loi-Sing, Michael Ealy, Uzo Aduba",United States,25-Aug-21,2020,TV-MA,95 min,"Dramas, Independent Movies, Romantic Movies"
s229,Movie,The November Man,"Pierce Brosnan, Luke Bracey, Olga Kurylenko, Eliza Taylor, Caterina Scorsone, Bill Smitrovich, Will Patton, Amila Terzimehic, Lazar Ristovski, Mediha Musliovic","United States, United Kingdom",25-Aug-21,2014,R,108 min,Action & Adventure
s230,Movie,The Old Ways,"Brigitte Kali Canales, Andrea Cortes, Julia Vera, Sal Lopez",United States,25-Aug-21,2020,TV-MA,90 min,Horror Movies
s232,Movie,The Water Man,"David Oyelowo, Rosario Dawson, Lonnie Chavis, Amiah Miller, Alfred Molina, Maria Bello",United States,25-Aug-21,2021,PG,92 min,"Children & Family Movies, Dramas"
s233,TV Show,Wheel of Fortune,"Pat Sajak, Vanna White",United States,25-Aug-21,2019,TV-G,3 Seasons,Reality TV
s234,Movie,Count Me In,,United Kingdom,24-Aug-21,2021,TV-MA,82 min,"Documentaries, Music & Musicals"
s242,TV Show,Manifest,"Melissa Roxburgh, Josh Dallas, Athena Karkanis, J.R. Ramirez, Luna Blaise, Jack Messina, Parveen Kaur",United States,21-Aug-21,2021,TV-14,3 Seasons,"TV Dramas, TV Mysteries, TV Sci-Fi & Fantasy"
s248,Movie,Sweet Girl,"Jason Momoa, Isabela Merced, Manuel Garcia-Rulfo, Amy Brenneman, Adria Arjona, Raza Jaffrey, Justin Bartha, Lex Scott Davis, Michael Raymond-James",United States,20-Aug-21,2021,R,110 min,"Action & Adventure, Dramas"
s252,Movie,Like Crazy,"Anton Yelchin, Felicity Jones, Jennifer Lawrence, Charlie Bewley, Alex Kingston, Oliver Muirhead, Finola Hughes, Chris Messina, Ben York Jones, Jamie Thomas King",United States,19-Aug-21,2011,PG-13,91 min,"Dramas, Independent Movies, Romantic Movies"
s255,TV Show,Go! Go! Cory Carson,"Alan C. Lim, Paul Killam, Maisie Benson, Kerry Gudjohnsen, Smith Foreman, Neena-Sinaii Simpo, Eli Morse, Adelaide Hirasaki, Jim Capobianco, Anna Chambers, Pfifer Chastain",United States,18-Aug-21,2021,TV-Y,5 Seasons,Kids' TV
s264,TV Show,Mother Goose Club,,United States,16-Aug-21,2016,TV-Y,2 Seasons,Kids' TV
s265,Movie,Walk of Shame,"Elizabeth Banks, James Marsden, Gillian Jacobs, Sarah Wright, Ethan Suplee, Bill Burr, Ken Davitian, Lawrence Gilliard Jr., Alphonso Mcauley, Da'Vone McDonald, John Marsden, Willie Garson, Oliver Hudson, P.J. Byrne",United States,16-Aug-21,2014,R,94 min,"Comedies, Independent Movies"
s268,Movie,The Piano,"Holly Hunter, Harvey Keitel, Sam Neill, Anna Paquin, Kerry Walker, Genevieve Lemon, Tungia Baker, Ian Mune","New Zealand, Australia, France, United States",15-Aug-21,1993,R,121 min,"Classic Movies, Dramas, Independent Movies"
s272,TV Show,Brand New Cherry Flavor,"Rosa Salazar, Eric Lange, Catherine Keener, Jeff Ward, Manny Jacinto, Hannah Levien, Patrick Fischler",United States,13-Aug-21,2021,TV-MA,1 Season,"TV Dramas, TV Horror, TV Mysteries"
s273,TV Show,Fast & Furious Spy Racers,"Tyler Posey, Charlet Chung, Jorge Diaz, Camille Ramsey, Luke Youngblood, Renée Elise Goldsberry",United States,13-Aug-21,2021,TV-Y7,5 Seasons,Kids' TV
s275,TV Show,Grace and Frankie,"Jane Fonda, Lily Tomlin, Martin Sheen, Sam Waterston, June Diane Raphael, Brooklyn Decker, Ethan Embry, Baron Vaughn",United States,13-Aug-21,2021,TV-MA,7 Seasons,"TV Comedies, TV Dramas"
s280,Movie,Monster Hunter: Legends of the Guild,"Ben Rausch, Erica Lindbeck, Dante Basco, Brando Eaton, Stephen Kramer Glickman, Caroline Caliston, G.K. Bowes, Dan McCoy","United States, Japan",12-Aug-21,2021,TV-PG,59 min,"Action & Adventure, Anime Features, Children & Family Movies"
s281,TV Show,Bake Squad,,United States,11-Aug-21,2021,TV-PG,1 Season,Reality TV
s284,Movie,Misha and the Wolves,,"Belgium, United Kingdom",11-Aug-21,2021,PG-13,90 min,"Documentaries, International Movies"
s285,Movie,The Kissing Booth 3,"Joey King, Joel Courtney, Jacob Elordi, Molly Ringwald, Taylor Zakhar Perez, Maisie Richardson-Sellers, Meganne Young, Stephen Jennings","United Kingdom, United States",11-Aug-21,2021,TV-14,114 min,"Comedies, Romantic Movies"
s286,Movie,The Railway Man,"Colin Firth, Nicole Kidman, Jeremy Irvine, Stellan Skarsgård, Sam Reid, Hiroyuki Sanada, Michael MacKenzie, Tom Stokes","Switzerland, United Kingdom, Australia",11-Aug-21,2013,R,108 min,"Dramas, International Movies"
s287,TV Show,Gabby's Dollhouse,"Laila Lockhart Kraner, Tucker Chandler, Juliet Donenfeld, Maggi Lowe, Donovan Patton, Eduardo Franco, Tara Strong, Secunda Wood, Carla Tassara, Sainty Nelsen",United States,10-Aug-21,2021,TV-Y,2 Seasons,Kids' TV
s291,Movie,Untold: Malice at the Palace,,United States,10-Aug-21,2021,TV-MA,70 min,"Documentaries, Sports Movies"
s293,Movie,Quartet,"Maggie Smith, Tom Courtenay, Billy Connolly, Pauline Collins, Michael Gambon, Andrew Sachs, Sheridan Smith, David Ryall, Trevor Peacock, Gwyneth Jones",United Kingdom,08-Aug-21,2012,PG-13,98 min,"Comedies, Dramas, Independent Movies"
s296,Movie,The Paper Tigers,"Alain Uy, Ron Yuan, Mykel Shannon Jenkins, Jae Suh Park, Matthew Page, Joziah Lagonoy, Raymond Ma",United States,07-Aug-21,2021,PG-13,111 min,"Action & Adventure, Comedies"
s297,TV Show,Hit & Run,"Lior Raz, Kaelen Ohm, Sanaa Lathan, Moran Rosenblatt, Lior Ashkenazi, Gregg Henry, Gal Toren","Israel, United States",06-Aug-21,2021,TV-MA,1 Season,"TV Action & Adventure, TV Dramas, TV Mysteries"
